{
  "$schema": "../../schema/scenario.schema.json",
  "name": "Employee onboarding flow",
  "description": "Company with onboarding-ready setup for testing employee onboarding.",
  "domain": "employee",
  "baseDemo": "react_sdk_demo_company_onboarded",
  "decorations": {
    "locations": [
      {
        "key": "hq",
        "street_1": "100 Test St",
        "city": "San Francisco",
        "state": "CA",
        "zip": "94105",
        "filing_address": true,
        "mailing_address": true
      }
    ]
  },
  "expectedContext": ["companyId", "locationIds.hq"]
}
