{
  "$schema": "../../schema/scenario.schema.json",
  "name": "Employee onboarding entry-screen",
  "description": "Onboarded company with one location so the employee list renders. The consuming specs (employee-onboarding-entry) only assert the Add CTA and the basics form — neither interacts with the work-address picker, so the historical 'multi-location' second site has been removed to save provisioning time.",
  "domain": "employee",
  "baseDemo": "react_sdk_demo_company_onboarded",
  "decorations": {
    "locations": [
      {
        "key": "hq",
        "street_1": "500 3rd Street",
        "city": "San Francisco",
        "state": "CA",
        "zip": "94107",
        "filing_address": true,
        "mailing_address": true
      }
    ]
  },
  "expectedContext": ["companyId", "locationIds.hq"]
}
