{
  "$schema": "../../schema/scenario.schema.json",
  "name": "Transition payroll surface",
  "description": "Onboarded company with a biweekly pay schedule used by transition.spec.ts to drive the TransitionFlow UI. The fixture injects scenario.paySchedule.uuid into the page URL via localTestFixture's page.goto override, so the schedule decoration is load-bearing. Specs use hardcoded transition start/end dates from e2e/main.tsx — they don't rely on actual processed payroll history, so the previous 'history-1 with status=processed' decoration is removed. The runner could never satisfy that decoration anyway because the demo company is missing tax/W-4/SSN data, so the calculate step always 422'd with payroll_blocker:missing_forms and the runner skipped the rest of processPayroll.",
  "domain": "payroll",
  "baseDemo": "react_sdk_demo_company_onboarded",
  "decorations": {
    "locations": [
      {
        "key": "hq",
        "street_1": "300 Test Blvd",
        "city": "San Francisco",
        "state": "CA",
        "zip": "94105",
        "filing_address": true,
        "mailing_address": true
      }
    ],
    "employees": [
      {
        "key": "alice",
        "$ref": "../fragments/w2-salaried-employee.json",
        "overrides": {
          "first_name": "Alice",
          "last_name": "Anderson",
          "email": "alice-tr+{{ts}}@example.com"
        }
      }
    ],
    "paySchedule": {
      "frequency": "Every other week",
      "anchor_pay_date": "{{relative:+14d:Friday}}",
      "anchor_end_of_pay_period": "{{relative:+13d}}"
    }
  },
  "expectedContext": ["companyId", "employeeIds.alice", "paySchedule.uuid"]
}
